hierarchyId	pCFID	name	fileName	verb	object	activity
9.7.6.2.3	19577	Determine interest rate hedge requirements in accordance with risk policy	19577-DetermineInterestRateHedgeRequirementsInAccordanceWithRiskPolicy.mdx	Determine	Interest Rate Hedge Requirements In Accordance With Risk Policy	Manage interest rate risk
9.7.6.2.4	19578	Execute interest rate trades	19578-ExecuteInterestRateTrades.mdx	Execute	Interest Rate Trades	Manage interest rate risk
9.7.6.3.1	19579	Manage foreign exchange market data	19579-ManageForeignExchangeMarketData.mdx	Manage	Foreign Exchange Market Data	Manage foreign exchange risk
9.7.6.3.2	19580	Determine foreign exchange exposure for all currencies	19580-DetermineForeignExchangeExposureForAllCurrencies.mdx	Determine	Foreign Exchange Exposure For All Currencies	Manage foreign exchange risk
9.7.6.3.3	19581	Determine foreign exchange hedge requirements in accordance with risk policy	19581-DetermineForeignExchangeHedgeRequirementsInAccordanceWithRiskPolicy.mdx	Determine	Foreign Exchange Hedge Requirements In Accordance With Risk Policy	Manage foreign exchange risk
9.7.6.3.4	19582	Execute foreign exchange trades	19582-ExecuteForeignExchangeTrades.mdx	Execute	Foreign Exchange Trades	Manage foreign exchange risk
9.7.6.3.5	19583	Manage foreign exchange balance sheet risk	19583-ManageForeignExchangeBalanceSheetRisk.mdx	Manage	Foreign Exchange Balance Sheet Risk	Manage foreign exchange risk
9.7.6.4.1	19584	Determine current customer exposures and limit exceptions	19584-DetermineCurrentCustomerExposuresAndLimitExceptions.mdx	Determine	Current Customer Exposures And Limit Exceptions	Manage exposure risk
9.7.6.4.2	19585	Resolve customer exposure limit violations	19585-ResolveCustomerExposureLimitViolations.mdx	Resolve	Customer Exposure Limit Violations	Manage exposure risk
9.7.6.4.3	19586	Manage customer collateral	19586-ManageCustomerCollateral.mdx	Manage	Customer Collateral	Manage exposure risk
9.7.6.4.4	19587	Perform annual customer credit reviews	19587-PerformAnnualCustomerCreditReviews.mdx	Perform	Annual Customer Credit Reviews	Manage exposure risk
9.7.6.5.1	19588	Measure physical positions	19588-MeasurePhysicalPositions.mdx	Measure	Physical Positions	Execute hedging transactions
9.7.6.5.2	19589	Establish hedges	19589-EstablishHedges.mdx	Establish	Hedges	Execute hedging transactions
9.7.6.5.3	19590	Unwind hedges	19590-UnwindHedges.mdx	Unwind	Hedges	Execute hedging transactions
9.7.6.5.4	11213	Evaluate and refine hedging positions	11213-EvaluateAndRefineHedgingPositions.mdx	Evaluate	And Refine Hedging Positions	Execute hedging transactions
9.7.6.5.5	11215	Monitor credit	11215-MonitorCredit.mdx	Monitor	Credit	Execute hedging transactions
11.1.4.3.1	18129	Assess adequacy of insurance coverage	18129-AssessAdequacyOfInsuranceCoverage.mdx	Assess	Adequacy Of Insurance Coverage	Develop mitigation plans for risks
13.1.3.2.1	20140	Identify published best practices	20140-IdentifyPublishedBestPractices.mdx	Identify	Published Best Practices	Analyze processes
13.1.4.3.1	20141	Identify additional metrics as required	20141-IdentifyAdditionalMetricsAsRequired.mdx	Identify	Additional Metrics As Required	Measure and report process performance
13.2.3.1.1	11117	Identify project requirements and objectives	11117-IdentifyProjectRequirementsAndObjectives.mdx	Identify	Project Requirements And Objectives	Establish project scope
13.2.3.1.2	16412	Identify project resource requirements	16412-IdentifyProjectResourceRequirements.mdx	Identify	Project Resource Requirements	Establish project scope
13.2.3.1.3	11118	Assess culture and readiness for project management approach	11118-AssessCultureAndReadinessForProjectManagementApproach.mdx	Assess	Culture And Readiness For Project Management Approach	Establish project scope
13.2.3.1.4	11120	Create business case and obtain funding	11120-CreateBusinessCaseAndObtainFunding.mdx	Create	Business Case And Obtain Funding	Establish project scope
13.2.3.1.5	11121	Develop project measures and indicators	11121-DevelopProjectMeasuresAndIndicators.mdx	Develop	Project Measures And Indicators	Establish project scope
13.2.3.3.1	11123	Define roles and resources	11123-DefineRolesAndResources.mdx	Define	Roles And Resources	Develop project plans
13.2.3.3.2	20142	Acquire/secure project resources	20142-AcquireSecureProjectResources.mdx	Acquire/secure	Project Resources	Develop project plans
13.2.3.3.3	11124	Identify specific IT requirements	11124-IdentifySpecificItRequirements.mdx	Identify	Specific IT Requirements	Develop project plans
13.2.3.3.4	11125	Create training and communication plans	11125-CreateTrainingAndCommunicationPlans.mdx	Create	Training And Communication Plans	Develop project plans
13.2.3.3.5	11127	Design recognition and reward approaches	11127-DesignRecognitionAndRewardApproaches.mdx	Design	Recognition And Reward Approaches	Develop project plans
13.2.3.3.6	11128	Design and plan launch of project	11128-DesignAndPlanLaunchOfProject.mdx	Design	And Plan Launch Of Project	Develop project plans
13.2.3.3.7	11129	Deploy the project	11129-DeployTheProject.mdx	Deploy	Project	Develop project plans
13.2.3.4.1	11131	Evaluate impact of project management (strategy and projects) on measures and outcomes	11131-EvaluateImpactOfProjectManagementStrategyAndProjectsOnMeasuresAndOutcomes.mdx	Evaluate	Impact Of Project Management (strategy And Projects) On Measures And Outcomes	Execute projects
13.2.3.4.2	16415	Report the status of project	16415-ReportTheStatusOfProject.mdx	Report	Status Of Project	Execute projects
13.2.3.4.3	16416	Manage project scope	16416-ManageProjectScope.mdx	Manage	Project Scope	Execute projects
13.2.3.4.4	11132	Promote and sustain activity and involvement	11132-PromoteAndSustainActivityAndInvolvement.mdx	Promote	And Sustain Activity And Involvement	Execute projects
13.2.3.4.5	11133	Realign and refresh project management strategy and approaches	11133-RealignAndRefreshProjectManagementStrategyAndApproaches.mdx	Realign	And Refresh Project Management Strategy And Approaches	Execute projects
13.3.1.3.1	17476	Define process steps for controls (or integration points)	17476-DefineProcessStepsForControlsOrIntegrationPoints.mdx	Define	Process Steps For Controls (or Integration Points)	Develop quality controls
13.3.1.3.2	17477	Define sampling plan	17477-DefineSamplingPlan.mdx	Define	Sampling Plan	Develop quality controls
13.3.1.3.3	17478	Identify measurement methods	17478-IdentifyMeasurementMethods.mdx	Identify	Measurement Methods	Develop quality controls
13.3.1.3.4	17479	Define required competencies	17479-DefineRequiredCompetencies.mdx	Define	Required Competencies	Develop quality controls
13.3.2.1.1	17484	Conduct test and collect data	17484-ConductTestAndCollectData.mdx	Conduct	Test And Collect Data	Test against quality plan
13.3.2.1.2	17485	Record result(s)	17485-RecordResultS.mdx	Record	Result(s)	Test against quality plan
13.3.2.1.3	17486	Determine disposition of result(s)	17486-DetermineDispositionOfResultS.mdx	Determine	Disposition Of Result(s)	Test against quality plan
13.3.2.2.1	17488	Assess sample significance	17488-AssessSampleSignificance.mdx	Assess	Sample Significance	Assess results of tests
13.3.2.2.2	17489	Summarize result(s)	17489-SummarizeResultS.mdx	Summarize	Result(s)	Assess results of tests
13.3.2.2.3	17490	Recommend actions	17490-RecommendActions.mdx	Recommend	Actions	Assess results of tests
13.3.2.2.4	17491	Decide next steps	17491-DecideNextSteps.mdx	Decide	Next Steps	Assess results of tests
13.3.4.6.1	17505	Reward quality excellence	17505-RewardQualityExcellence.mdx	Reward	Quality Excellence	Create environment and capability for EQMS improvement(s)
13.3.4.6.2	17506	Create and maintain quality partnerships	17506-CreateAndMaintainQualityPartnerships.mdx	Create	And Maintain Quality Partnerships	Create environment and capability for EQMS improvement(s)
13.3.4.6.3	17507	Maintain talent capabilities and competencies	17507-MaintainTalentCapabilitiesAndCompetencies.mdx	Maintain	Talent Capabilities And Competencies	Create environment and capability for EQMS improvement(s)
13.3.4.6.4	17508	Incorporate EQMS messaging into communication channels	17508-IncorporateEqmsMessagingIntoCommunicationChannels.mdx	Incorporate	EQMS Messaging Into Communication Channels	Create environment and capability for EQMS improvement(s)
13.3.4.6.5	17509	Assure independent EQMS management access to appropriate authority in the organization	17509-AssureIndependentEqmsManagementAccessToAppropriateAuthorityInTheOrganization.mdx	Assure	Independent EQMS Management Access To Appropriate Authority In Organization	Create environment and capability for EQMS improvement(s)
13.3.4.6.6	17510	Transfer proven EQMS methods	17510-TransferProvenEqmsMethods.mdx	Transfer	Proven EQMS Methods	Create environment and capability for EQMS improvement(s)
